{
  "declarationSha256": "7e3cba0299321277d5af23a9bc83ba79e58b75ed4ba4c5fdbdf4a95b55f93d2b",
  "declarations": {
    "constant": {
      "name": "RL_QUADS",
      "value": 7
    },
    "functions": [
      {
        "name": "rlBegin",
        "parameters": [
          {
            "name": "mode",
            "type": {
              "cType": "int",
              "canonicalCType": "int",
              "haxeType": "c.Int32"
            }
          }
        ],
        "returnType": {
          "cType": "void",
          "canonicalCType": "void",
          "haxeType": "Void"
        },
        "sourceLine": 618
      },
      {
        "name": "rlColor4ub",
        "parameters": [
          {
            "name": "r",
            "type": {
              "cType": "unsigned char",
              "canonicalCType": "unsigned char",
              "haxeType": "c.UInt8"
            }
          },
          {
            "name": "g",
            "type": {
              "cType": "unsigned char",
              "canonicalCType": "unsigned char",
              "haxeType": "c.UInt8"
            }
          },
          {
            "name": "b",
            "type": {
              "cType": "unsigned char",
              "canonicalCType": "unsigned char",
              "haxeType": "c.UInt8"
            }
          },
          {
            "name": "a",
            "type": {
              "cType": "unsigned char",
              "canonicalCType": "unsigned char",
              "haxeType": "c.UInt8"
            }
          }
        ],
        "returnType": {
          "cType": "void",
          "canonicalCType": "void",
          "haxeType": "Void"
        },
        "sourceLine": 625
      },
      {
        "name": "rlDisableDepthMask",
        "parameters": [],
        "returnType": {
          "cType": "void",
          "canonicalCType": "void",
          "haxeType": "Void"
        },
        "sourceLine": 674
      },
      {
        "name": "rlDrawRenderBatchActive",
        "parameters": [],
        "returnType": {
          "cType": "void",
          "canonicalCType": "void",
          "haxeType": "Void"
        },
        "sourceLine": 728
      },
      {
        "name": "rlEnableDepthMask",
        "parameters": [],
        "returnType": {
          "cType": "void",
          "canonicalCType": "void",
          "haxeType": "Void"
        },
        "sourceLine": 673
      },
      {
        "name": "rlEnd",
        "parameters": [],
        "returnType": {
          "cType": "void",
          "canonicalCType": "void",
          "haxeType": "Void"
        },
        "sourceLine": 619
      },
      {
        "name": "rlNormal3f",
        "parameters": [
          {
            "name": "x",
            "type": {
              "cType": "float",
              "canonicalCType": "float",
              "haxeType": "c.Float32"
            }
          },
          {
            "name": "y",
            "type": {
              "cType": "float",
              "canonicalCType": "float",
              "haxeType": "c.Float32"
            }
          },
          {
            "name": "z",
            "type": {
              "cType": "float",
              "canonicalCType": "float",
              "haxeType": "c.Float32"
            }
          }
        ],
        "returnType": {
          "cType": "void",
          "canonicalCType": "void",
          "haxeType": "Void"
        },
        "sourceLine": 624
      },
      {
        "name": "rlSetTexture",
        "parameters": [
          {
            "name": "id",
            "type": {
              "cType": "unsigned int",
              "canonicalCType": "unsigned int",
              "haxeType": "c.UInt32"
            }
          }
        ],
        "returnType": {
          "cType": "void",
          "canonicalCType": "void",
          "haxeType": "Void"
        },
        "sourceLine": 731
      },
      {
        "name": "rlTexCoord2f",
        "parameters": [
          {
            "name": "x",
            "type": {
              "cType": "float",
              "canonicalCType": "float",
              "haxeType": "c.Float32"
            }
          },
          {
            "name": "y",
            "type": {
              "cType": "float",
              "canonicalCType": "float",
              "haxeType": "c.Float32"
            }
          }
        ],
        "returnType": {
          "cType": "void",
          "canonicalCType": "void",
          "haxeType": "Void"
        },
        "sourceLine": 623
      },
      {
        "name": "rlVertex3f",
        "parameters": [
          {
            "name": "x",
            "type": {
              "cType": "float",
              "canonicalCType": "float",
              "haxeType": "c.Float32"
            }
          },
          {
            "name": "y",
            "type": {
              "cType": "float",
              "canonicalCType": "float",
              "haxeType": "c.Float32"
            }
          },
          {
            "name": "z",
            "type": {
              "cType": "float",
              "canonicalCType": "float",
              "haxeType": "c.Float32"
            }
          }
        ],
        "returnType": {
          "cType": "void",
          "canonicalCType": "void",
          "haxeType": "Void"
        },
        "sourceLine": 622
      }
    ]
  },
  "extraction": {
    "arguments": [
      "--target=x86_64-unknown-linux-gnu",
      "-x",
      "c",
      "-std=c11",
      "-ffreestanding",
      "-I",
      "${RAYLIB_INCLUDE}",
      "-Xclang",
      "-ast-dump=json",
      "-fsyntax-only",
      "${RLGL_HEADER}"
    ],
    "authority": "clang-ast-and-preprocessor",
    "clang": {
      "dumpMachine": "arm64-apple-darwin24.4.0",
      "family": "clang",
      "version": "Apple clang version 17.0.0 (clang-1700.0.13.3)"
    },
    "requestedTarget": "x86_64-unknown-linux-gnu"
  },
  "generatedPaths": [
    "src/raylib/raw/Rlgl.hx",
    "test/raylib_provisioning/native/rlgl_abi_probe.c"
  ],
  "generator": {
    "algorithm": "hxc-raylib-clang-rlgl-v1",
    "path": "scripts/raylib/rlgl_binding.py"
  },
  "schemaVersion": 1,
  "selection": {
    "counts": {
      "constants": 1,
      "functions": 10,
      "omittedFamilies": 1
    },
    "coverageState": "caxecraft-quad-batch-only",
    "omissions": [
      {
        "family": "remaining-rlgl-api",
        "owner": "haxe_c-xge.10",
        "reason": "Caxecraft needs one texture-bound quad batch, an explicit flush for deterministic current-frame captures, and one balanced depth-write toggle for its sorted transparent-water pass; matrices, shaders, buffers, framebuffers, and other raw graphics state remain outside this reviewed slice."
      }
    ],
    "path": "docs/specs/raylib-rlgl-selection.json",
    "sha256": "19929d9aa7fc8ea568800e2eb87d124c69627471329413b9886b52877ad9455b"
  },
  "upstream": {
    "commit": "dbc56a87da87d973a9c5baa4e7438a9d20121d28",
    "header": {
      "path": "src/rlgl.h",
      "sha256": "1c9b802c219971dbf2ba9725fb8cea3f14616c039891810a2d31aa442aea4be3"
    },
    "licenseExpression": "Zlib",
    "licenseUrl": "https://github.com/raysan5/raylib/blob/dbc56a87da87d973a9c5baa4e7438a9d20121d28/LICENSE",
    "name": "raylib",
    "release": "6.0"
  }
}
